<?xml version="1.0" encoding="UTF-8" standalone="no"?>
<!--<!DOCTYPE adempiereTrl PUBLIC "-//ComPiere, Inc.//DTD Adempiere Translation 1.0//EN" "http://www.adempiere.net/dtd/adempiereTrl.dtd">-->
<adempiereTrl language="de_DE" table="CM_Container_Element">
 <row id="100" trl="N">
  <value column="Name" original="content1">content1</value>
  <value column="Description" original=""/>
  <value column="Help" original=""/>
 </row>
 <row id="101" trl="N">
  <value column="Name" original="headline1">headline1</value>
  <value column="Description" original=""/>
  <value column="Help" original=""/>
 </row>
 <row id="102" trl="N">
  <value column="Name" original="content1">content1</value>
  <value column="Description" original=""/>
  <value column="Help" original=""/>
 </row>
 <row id="103" trl="N">
  <value column="Name" original="headline1">headline1</value>
  <value column="Description" original=""/>
  <value column="Help" original=""/>
 </row>
 <row id="104" trl="N">
  <value column="Name" original="content1">content1</value>
  <value column="Description" original=""/>
  <value column="Help" original=""/>
 </row>
 <row id="105" trl="N">
  <value column="Name" original="headline1">headline1</value>
  <value column="Description" original=""/>
  <value column="Help" original=""/>
 </row>
</adempiereTrl>
